{
  "schema_version": "ultrajarvis.response-packet/v1",
  "response_id": "UJ-RESPONSE-GGL-001-GEMINI-001",
  "created_at": "2026-08-18T13:35:00Z",
  "card_id": "UJ-CARD-GGL-001-GEMINI",
  "mission_id": "UJ-MISSION-M0-COUNCIL-001",
  "ai_id": "GEMINI",
  "product": "Google Gemini",
  "source_commit_sha": "3611b1b400cf57b5021bab228a3de9470d6eca5c",
  "capabilities_actually_used": [
    {
      "capability": "python_interpreter",
      "access_path": "Gemini-provided local analysis environment",
      "mode": "EXPERIMENTAL_SANDBOX"
    },
    {
      "capability": "official_documentation_cross_referencing",
      "access_path": "Official Google AI, Firebase, Apps Script, Colab, and Gemini terms URLs",
      "mode": "MANUAL_TOOL"
    }
  ],
  "task_id": "UJ-GGL-001",
  "status": "REVIEW",
  "executive_delta": "Repaired the Google evidence pack, separated verified quota facts from account-specific or unsupported privacy claims, and added the missing billing, region, terms, side-effect, and preview-model gates.",
  "facts": [
    {
      "claim": "Google's Gemini API terms distinguish Unpaid and Paid Services and state that EEA, Switzerland, and UK users receive the Paid Services data-use treatment for all Services even when offered free.",
      "classification": "VERIFIED_FACT",
      "source_ref": "https://ai.google.dev/gemini-api/terms",
      "verified_at": "2026-08-18T13:35:00Z"
    },
    {
      "claim": "Google's Colab FAQ says free resources are not guaranteed or unlimited, usage limits fluctuate, and idle timeouts, maximum VM lifetime, and available hardware vary over time.",
      "classification": "VERIFIED_FACT",
      "source_ref": "https://research.google.com/colaboratory/faq.html",
      "verified_at": "2026-08-18T13:35:00Z"
    },
    {
      "claim": "Cloud Firestore documents one free database per project and free quotas of 1 GiB stored data, 50,000 reads/day, 20,000 writes/day, 20,000 deletes/day, and 10 GiB/month outbound transfer; quotas reset around midnight Pacific time.",
      "classification": "VERIFIED_FACT",
      "source_ref": "https://firebase.google.com/docs/firestore/quotas",
      "verified_at": "2026-08-18T13:35:00Z"
    },
    {
      "claim": "Apps Script quotas are account-type dependent, per user, reset 24 hours after the first request, and are subject to change without notice.",
      "classification": "VERIFIED_FACT",
      "source_ref": "https://developers.google.com/apps-script/guides/services/quotas",
      "verified_at": "2026-08-18T13:35:00Z"
    },
    {
      "claim": "The Google evidence pack does not itself authorize UJ-INF-001, UJ-MEM-001, UJ-KNW-001, UJ-MED-001, or UJ-ADK-001.",
      "classification": "OBSERVATION",
      "source_ref": "docs/evidence/GOOGLE_CAPABILITY_EVIDENCE_PACK.md",
      "verified_at": "2026-08-18T13:35:00Z"
    }
  ],
  "assumptions": [
    {
      "statement": "No live Google account, project, billing, quota, Workspace, NotebookLM, Firebase, or preview entitlement was inspected.",
      "validation": "Run account-level checks and attach dated screenshots or exported settings before using a conditional route.",
      "expiry": "2026-08-19T00:00:00Z"
    },
    {
      "statement": "NotebookLM privacy is not proven by the support homepage alone.",
      "validation": "Attach the exact current privacy/FAQ article and applicable account terms.",
      "expiry": null
    },
    {
      "statement": "Apps Script triggers, webhooks, OAuth grants, and document writes are side effects even when the service itself has no usage fee.",
      "validation": "Issue a separate DelegationCard/approval for each external or scheduled write.",
      "expiry": null
    }
  ],
  "decisions_proposed": [
    {
      "decision_id": "DEC-GGL-001",
      "proposal": "Keep the Google evidence pack as REVIEW-only and preserve all five downstream tasks as BLOCKED until the named dependency and review gates pass.",
      "owner": "CHATGPT",
      "gate": "Grok peer review plus Council admission"
    },
    {
      "decision_id": "DEC-GGL-002",
      "proposal": "Classify NotebookLM privacy, Firebase data isolation, EEA/API-client eligibility, and preview/commercial rights as conditional evidence gates rather than unconditional approvals.",
      "owner": "Christian",
      "gate": "Exact dated primary sources and owner decision where protected policy is affected"
    }
  ],
  "artifacts": [
    {
      "ref": "docs/evidence/GOOGLE_CAPABILITY_EVIDENCE_PACK.md",
      "sha256": "4fa97cf76265ec64e914ebf22d9c94a8ec431f23bb3a647d0418a0670a4767ac",
      "media_type": "text/markdown",
      "data_class": "C1",
      "summary": "Corrected Google ecosystem evidence pack with 12 surfaces, conditional routing, and explicit missing-evidence gates."
    }
  ],
  "verification": {
    "checks_run": [
      "Repaired registry JSON was parsed and reserialized as strict UTF-8 JSON.",
      "Markdown and JSON capability IDs were compared after repair.",
      "Official source URLs were retained for each material Google claim.",
      "SHA-256 hashes were calculated from the exact corrected output bytes.",
      "ResponsePacket fields were checked against schemas/response-packet.schema.json."
    ],
    "passed": [
      "The registry contains 19 matching capability IDs across Markdown and JSON.",
      "No billing, consumer UI automation, secret, or direct-main write was performed.",
      "The proposed ledger delta keeps accepted weight at zero and only proposes REVIEW."
    ],
    "failed": [],
    "not_run": [
      "Live Google account/project billing and quota inspection.",
      "NotebookLM account-specific privacy/terms verification.",
      "Live end-to-end API, WebSocket, Firebase, or Apps Script invocation.",
      "Independent peer review by the named reviewer."
    ]
  },
  "side_effects": [
    {
      "classification": "NONE",
      "description": "No repository, account, billing, external service, or destructive write was performed by this response.",
      "approval_ref": null,
      "idempotency_key": "UJ-RESPONSE-GGL-001-GEMINI-001-NO-SIDE-EFFECTS",
      "proof_ref": "local-correction-audit"
    }
  ],
  "risks": [
    {
      "risk_id": "R-001",
      "event": "A free or preview Google surface changes limits, availability, or terms.",
      "severity": "MEDIUM",
      "trigger": "Current documentation or account dashboard differs from this evidence pack.",
      "mitigation": "Revalidate at dispatch and preserve UNKNOWN status until evidence is refreshed.",
      "owner": "GROK"
    },
    {
      "risk_id": "R-002",
      "event": "Spark or free-tier usage crosses a product or billing boundary.",
      "severity": "HIGH",
      "trigger": "A feature requires Blaze/Cloud Billing or the project is linked to a paid account.",
      "mitigation": "Stop, keep the task BLOCKED, and fall back to local storage or HUMAN_BRIDGE.",
      "owner": "CHATGPT"
    },
    {
      "risk_id": "R-003",
      "event": "A manual bridge is mistaken for authorization to perform an external write.",
      "severity": "HIGH",
      "trigger": "Apps Script trigger, webhook, OAuth grant, document write, or message send is requested without an approval_ref.",
      "mitigation": "Reject the side effect and require a separate scoped card and approval.",
      "owner": "Christian"
    }
  ],
  "task_ledger_delta": [
    {
      "task_id": "UJ-GGL-001",
      "previous_status": "READY",
      "proposed_status": "REVIEW",
      "weight": 13,
      "accepted_weight_before": 0,
      "proposed_accepted_weight": 0,
      "proof_refs": [
        "docs/evidence/GOOGLE_CAPABILITY_EVIDENCE_PACK.md"
      ]
    }
  ],
  "remaining_work": {
    "weight": 13,
    "blockers": [
      "Independent Grok review",
      "Live account/project/terms checks",
      "Exact NotebookLM privacy citation",
      "Side-effect approvals for Apps Script or other writes"
    ],
    "next_action": "The named reviewer (GROK) must independently validate the corrected artifacts; keep accepted weight at 0 until a valid ReviewResult."
  },
  "confidence": {
    "level": "MEDIUM",
    "reason": "The artifacts and packet structure are locally checked, but live account state, dynamic quotas, and several account/region-specific terms were not available for verification."
  },
  "policy_attestation": {
    "no_secret_values": true,
    "no_paid_api": true,
    "no_billing_enabled": true,
    "no_consumer_ui_automation": true,
    "no_heavy_local_inference": true,
    "within_data_class": true,
    "within_side_effect_limit": true
  },
  "handoff": {
    "target": "GROK",
    "next_action": "Review UJ-GGL-001 independently, validate the source scope and hashes, and return a schema-valid ReviewResult or requested corrections.",
    "resume_point": "At source commit 3611b1b400cf57b5021bab228a3de9470d6eca5c, the corrected UJ-GGL-001 artifacts are proposed as REVIEW with 0/13 accepted. Do not unlock downstream tasks until the named independent review and ledger admission succeed."
  }
}
